{
  "manifest_version": "1.0.0",
  "project_id": "SNBI-DF-ML",
  "created_at": "2026-09-16",
  "custody_policy": {
    "raw_sources_immutable": true,
    "raw_sources_committed": false,
    "verification_algorithm": "sha256"
  },
  "containers": [
    {
      "container_id": "VIDEO_ARCHIVE_01",
      "filename": "videos_trabalho_Final_IfGoiano.zip",
      "sha256": "9512a2e6d0ce397f9de8ae71cbf3cb759651df8e8793542a7c99cfe9d102d8f1",
      "size_bytes": 116199497
    }
  ],
  "sources": [
    {
      "source_id": "ESM1",
      "source_kind": "video",
      "modality": "xray_radiography",
      "condition": "bottom_up_anti_parallel",
      "semantic_role": "clean in situ X-ray radiography for the bottom-up condition",
      "sha256": "4d07ee422e97661b1ee0ae681b7617fd7971476015603f3039c20ddf8b0c5c6d",
      "size_bytes": 3233526,
      "hash_scope": "uncompressed_zip_member_bytes",
      "storage": {
        "kind": "zip_member",
        "container_id": "VIDEO_ARCHIVE_01",
        "member_path": "videos_trabalho_Final_IfGoiano/11837_2015_1646_MOESM1_ESM.mp4"
      },
      "redistribution": "external_not_redistributed"
    },
    {
      "source_id": "ESM2",
      "source_kind": "video",
      "modality": "relative_solute_field",
      "condition": "bottom_up_anti_parallel",
      "semantic_role": "normalized relative solute-distribution field for the bottom-up condition",
      "sha256": "4eb1762dc4ee65c3e8b1411d80812a75257b1324d539db4c3dcf6c97c1ed9a0a",
      "size_bytes": 41487560,
      "hash_scope": "uncompressed_zip_member_bytes",
      "storage": {
        "kind": "zip_member",
        "container_id": "VIDEO_ARCHIVE_01",
        "member_path": "videos_trabalho_Final_IfGoiano/11837_2015_1646_MOESM2_ESM.mp4"
      },
      "redistribution": "external_not_redistributed"
    },
    {
      "source_id": "ESM3",
      "source_kind": "video",
      "modality": "cumulative_fragmentation_annotation",
      "condition": "bottom_up_anti_parallel",
      "semantic_role": "cumulative fragmentation-location annotations for the bottom-up condition",
      "sha256": "d76a6466e50480a2116bc545a0ee2b8095cc14c54f861ecebee87de5b64e35be",
      "size_bytes": 3356196,
      "hash_scope": "uncompressed_zip_member_bytes",
      "storage": {
        "kind": "zip_member",
        "container_id": "VIDEO_ARCHIVE_01",
        "member_path": "videos_trabalho_Final_IfGoiano/11837_2015_1646_MOESM3_ESM.mp4"
      },
      "redistribution": "external_not_redistributed"
    },
    {
      "source_id": "ESM4",
      "source_kind": "video",
      "modality": "xray_radiography",
      "condition": "top_down_parallel",
      "semantic_role": "clean in situ X-ray radiography for the top-down condition",
      "sha256": "9e6be3e78699d3bdd16fa71d56917479d7e16f7418b857ab3925e1115df91ebe",
      "size_bytes": 4509283,
      "hash_scope": "uncompressed_zip_member_bytes",
      "storage": {
        "kind": "zip_member",
        "container_id": "VIDEO_ARCHIVE_01",
        "member_path": "videos_trabalho_Final_IfGoiano/11837_2015_1646_MOESM4_ESM.mp4"
      },
      "redistribution": "external_not_redistributed"
    },
    {
      "source_id": "ESM5",
      "source_kind": "video",
      "modality": "relative_solute_field",
      "condition": "top_down_parallel",
      "semantic_role": "normalized relative solute-distribution field for the top-down condition",
      "sha256": "c9054d18f330e018e82cc6bd4db2ccfbda7ac76e01326a831857a835d1feade6",
      "size_bytes": 59235679,
      "hash_scope": "uncompressed_zip_member_bytes",
      "storage": {
        "kind": "zip_member",
        "container_id": "VIDEO_ARCHIVE_01",
        "member_path": "videos_trabalho_Final_IfGoiano/11837_2015_1646_MOESM5_ESM.mp4"
      },
      "redistribution": "external_not_redistributed"
    },
    {
      "source_id": "ESM6",
      "source_kind": "video",
      "modality": "cumulative_fragmentation_annotation",
      "condition": "top_down_parallel",
      "semantic_role": "cumulative fragmentation-location annotations for the top-down condition",
      "sha256": "5b8747758afde34fb626f3c4ffbd0b49ba6ca6f6b49bfa81b8cf9ee8459280ea",
      "size_bytes": 4353042,
      "hash_scope": "uncompressed_zip_member_bytes",
      "storage": {
        "kind": "zip_member",
        "container_id": "VIDEO_ARCHIVE_01",
        "member_path": "videos_trabalho_Final_IfGoiano/11837_2015_1646_MOESM6_ESM.mp4"
      },
      "redistribution": "external_not_redistributed"
    },
    {
      "source_id": "COBEM_DIFFUSIVE",
      "source_kind": "document",
      "modality": "scientific_document",
      "condition": "not_applicable",
      "semantic_role": "diffusive solidification study used as a scientific interpretation axis",
      "sha256": "5abfcb88212555120d3be8c5bbeb2320a7861e209a5c3cceca1d7ec7c557dc2d",
      "size_bytes": 933759,
      "hash_scope": "raw_file_bytes",
      "storage": {"kind": "file", "filename": "document_cobem_difusivo(1).pdf"},
      "redistribution": "external_not_redistributed"
    },
    {
      "source_id": "COBEM_CONVECTIVE",
      "source_kind": "document",
      "modality": "scientific_document",
      "condition": "not_applicable",
      "semantic_role": "convective solidification study used as a scientific interpretation axis",
      "sha256": "4f40af67442f3558139bb5a8f74aa311b8def7e88cb4f3418ff80a4d31596b50",
      "size_bytes": 1527251,
      "hash_scope": "raw_file_bytes",
      "storage": {"kind": "file", "filename": "document_cobem_convectivo(1).pdf"},
      "redistribution": "external_not_redistributed"
    },
    {
      "source_id": "PHD_ACADEMIC_RECORD",
      "source_kind": "document",
      "modality": "academic_record",
      "condition": "not_applicable",
      "semantic_role": "documentary provenance for the doctoral origin of the scientific studies",
      "sha256": "0de8bc5713f8b226049f504ebc1b5d90059de8644733d4870b61fa5756e157de",
      "size_bytes": 651213,
      "hash_scope": "raw_file_bytes",
      "storage": {"kind": "file", "filename": "historico_doutorado.pdf"},
      "redistribution": "external_not_redistributed"
    }
  ]
}

